<!ELEMENT persoane (persoana+)>
<!ELEMENT persoana (nume, prenume, varsta, email, telefon, adresa)>
<!ATTLIST persoana id CDATA #REQUIRED>
<!ELEMENT nume (#PCDATA)>
<!ELEMENT prenume (#PCDATA)>
<!ELEMENT varsta (#PCDATA)>
<!ELEMENT email (#PCDATA)>
<!ELEMENT telefon (#PCDATA)>
<!ELEMENT adresa (strada, numar, localitate, judet, tara)>
<!ELEMENT strada (#PCDATA)>
<!ELEMENT numar (#PCDATA)>
<!ELEMENT localitate (#PCDATA)>
<!ELEMENT judet (#PCDATA)>
<!ELEMENT tara (#PCDATA)>